{
  "schema_version": "robot-config/1.0.0",
  "policy_version": "canonical_dfs_time_v1",
  "robot_model": "canonical_rect_robot_v1",
  "geometry": {
    "radius_mm": 175,
    "safety_margin_mm": 75,
    "door_anchor_offset_mm": 300
  },
  "dynamics": {
    "linear_speed_mm_per_s": 1000,
    "angular_speed_mdeg_per_s": 90000,
    "door_crossing_speed_mm_per_s": 1000
  },
  "fixed_action_duration_ms": {
    "SELECT_EXTERIOR_DOOR": 200,
    "SELECT_INTERIOR_DOOR": 200,
    "LOOK_FRONT": 300,
    "LOOK_LEFT": 300,
    "LOOK_RIGHT": 300,
    "STOP": 0
  },
  "planner": {
    "motion_model": "rectilinear",
    "objective": "minimum_execution_time",
    "loop_shortcuts": false
  },
  "tokenization": {
    "duration_bin_boundaries_ms": [
      0, 100, 200, 300, 400, 500, 750, 1000, 1250, 1500, 1750,
      2000, 2250, 2500, 2750, 3000, 3500, 4000, 4500, 5000,
      6000, 7000, 8000, 10000, 12000
    ],
    "length_bin_boundaries_mm": [500, 1000, 1500, 2000, 3000, 4000, 6000, 8000, 12000, 20000],
    "width_bin_boundaries_mm": [600, 800, 1000, 1200, 1500, 2000, 3000, 5000],
    "position_bin_boundaries_per_mille": [100, 200, 300, 400, 500, 600, 700, 800, 900, 1000],
    "max_local_rooms": 256,
    "max_local_doors": 512,
    "max_local_openings": 512
  }
}
